{
  "$schema": "https://json-schema.org/draft/2020-12/schema",
  "$id": "https://github.com/SwarupSG/learning-ux-design-dsai/site.config.schema.json",
  "title": "Site Configuration",
  "description": "Site-level metadata for the learning-ux-design-dsai template. The contract is documented in CONTENT-SPEC.md; the recipe for repurposing this template is in FORK.md.",
  "type": "object",
  "additionalProperties": false,
  "required": ["site", "author", "navigation"],

  "properties": {
    "$schema": {
      "type": "string",
      "description": "Path to this JSON Schema file. Enables IDE autocomplete and validation."
    },
    "_comment": {
      "type": "string",
      "description": "Free-form note about the file. Ignored by the build."
    },

    "site": {
      "type": "object",
      "additionalProperties": false,
      "required": ["title", "tagline", "description", "url", "language"],
      "properties": {
        "title":       { "type": "string", "description": "Display name of the site." },
        "tagline":     { "type": "string", "description": "One-line pitch shown under the title." },
        "description": { "type": "string", "description": "Longer description used for SEO and meta tags." },
        "url":         { "type": "string", "format": "uri", "description": "Canonical URL of the deployed site." },
        "language":    { "type": "string", "description": "ISO 639-1 language code, e.g. 'en'." },
        "locale":      { "type": "string", "description": "BCP 47 locale tag, e.g. 'en-IN' or 'en-GB'." }
      }
    },

    "author": {
      "type": "object",
      "additionalProperties": false,
      "required": ["name"],
      "properties": {
        "name":  { "type": "string" },
        "email": { "type": "string", "description": "Contact email for the site author." },
        "url":   { "type": "string", "description": "Personal or professional homepage." },
        "bio":   { "type": "string", "description": "One-line bio shown on the about page." }
      }
    },

    "navigation": {
      "type": "object",
      "additionalProperties": false,
      "required": ["primary"],
      "properties": {
        "_comment": { "type": "string" },
        "primary": {
          "type": "array",
          "minItems": 1,
          "items": {
            "type": "string",
            "pattern": "^[a-z0-9][a-z0-9-]*$",
            "description": "kebab-case section slug. Must match a folder name under /content/lessons/."
          },
          "description": "Section slugs in the order they should appear in the primary navigation."
        },
        "secondary": {
          "type": "array",
          "items": {
            "type": "string",
            "pattern": "^[a-z0-9][a-z0-9-]*$"
          },
          "description": "Secondary section slugs (e.g. 'build-diary'). Must match folder names under /content/."
        }
      }
    },

    "branding": {
      "type": "object",
      "additionalProperties": true,
      "description": "Design tokens. Open to extension so forks can expose extra brand variables.",
      "properties": {
        "_comment":    { "type": "string" },
        "accentColor": {
          "type": "string",
          "pattern": "^#([0-9A-Fa-f]{3}|[0-9A-Fa-f]{6})$",
          "description": "Hex colour for the site's accent (e.g. '#0066FF')."
        },
        "fontHeading": { "type": "string", "description": "Font family or stack used for headings." },
        "fontBody":    { "type": "string", "description": "Font family or stack used for body text." },
        "fontCode":    { "type": "string", "description": "Monospace font family or stack used for code blocks." },
        "logoText":    { "type": "string", "description": "Short site name shown in the header/navigation." },
        "favicon":     { "type": "string", "description": "Path to the favicon, relative to the public root." }
      }
    },

    "features": {
      "type": "object",
      "additionalProperties": false,
      "description": "Feature flags. Set to false to hide a feature without removing the code.",
      "properties": {
        "_comment":        { "type": "string" },
        "showBuildDiary":  { "type": "boolean" },
        "showAboutPage":   { "type": "boolean" },
        "showSearch":      { "type": "boolean" },
        "showDarkMode":    { "type": "boolean" },
        "showReadingTime": { "type": "boolean" }
      }
    },

    "footer": {
      "type": "object",
      "additionalProperties": false,
      "properties": {
        "copyright": { "type": "string", "description": "Copyright line displayed in the footer." },
        "links": {
          "type": "array",
          "items": {
            "type": "object",
            "additionalProperties": false,
            "required": ["label", "href"],
            "properties": {
              "label": { "type": "string" },
              "href":  { "type": "string", "description": "Absolute URL or relative path." }
            }
          }
        }
      }
    },

    "seo": {
      "type": "object",
      "additionalProperties": false,
      "description": "SEO defaults applied when a page does not override them.",
      "properties": {
        "_comment":      { "type": "string" },
        "defaultImage":  { "type": "string", "description": "Default Open Graph image, relative to the public root." },
        "twitterHandle": { "type": "string", "description": "Twitter/X handle (with or without '@')." }
      }
    }
  }
}
